id,Type,Topic,Year,Title,Authors,URL,pdf,Venue,Details
100,CO,2,2011,Build System Maintenance,167 226,http://www.slideshare.net/SAIL_QU/icse2011-src,ICSE2011_BuildSystemMaintenance.pdf,14,"In Proceedings of the ACM Student Research Competition of the 33rd International Conference on Software Engineering (ICSE 2011). Waikiki, Honolulu, Hawaii, USA. May 21-28, 2011."
101,CO,2,2011,Mining Software Repositories Using Topic Models,109 226,http://www.slideshare.net/SAIL_QU/icse2011-thomas-poster,ICSE2011_MiningSoftwareRepositoriesUsingTopicModels.pdf,14,"In Proceedings of the Doctoral Symposium Track of the 33rd International Conference on Software Engineering (ICSE 2011). Waikiki, Honolulu, Hawaii, USA. May 21-28, 2011."
102,CO,2,2011,Pragmatic Prioritization of Software Quality Assurance Efforts,116 226,http://www.slideshare.net/SAIL_QU/icse-2011-ds1,ICSE2011_PragmaticPrioritizationOfSoftwareQualityAssuranceEfforts.pdf,14,"In Proceedings of the Doctoral Symposium Track of the 33rd International Conference on Software Engineering (ICSE 2011). Waikiki, Honolulu, Hawaii, USA. May 21-28, 2011."
103,CO,2,2011,Recovering a Balanced Overview of Topics in a Software Domain,151 152 101 105,,SCAM2011_RecoveringABalancedOverviewOfTopicsInASoftwareDomain.pdf,29,"In Proceedings of the 11th IEEE International Working Conference on Source Code Analysis and Manipulation (SCAM 2011). September 25-26, 2011. Williamsburg, VA, US."
104,CO,2,2011,An Empirical Study of Build Maintenance Effort,167 101 168 147 105,http://www.slideshare.net/SAIL_QU/icse2011-src,ICSE2011_AnEmpiricalStudyOfBuildMaintenanceEffort.pdf,14,"In Proceedings of the 33rd International Conference on Software Engineering (ICSE 2011). Waikiki, Honolulu, Hawaii, USA. May 21-28, 2011."
105,CO,2,2011,Modeling the Evolution of Topics in Source Code Histories,109 101 105 185,http://www.slideshare.net/SAIL_QU/sthomas-slides,ICSE2011_ModelingTheEvolutionOfTopicsInSourceCodeHistories.pdf,15,"In Proceedings of the 8th Working Conference on Mining Software Repositories (MSR 2011). Waikiki, Honolulu, Hawaii, USA. May 21-22, 2011."
106,CO,2,2011,Security Versus Performance Bugs: A Case Study on Firefox,187 101 105,http://www.slideshare.net/SAIL_QU/msr2011-zaman,MSR2011_SecurityVersusPerformanceBugs_ACaseStudyOnFirefox.pdf,15,"In Proceedings of the 8th Working Conference on Mining Software Repositories (MSR 2011). Waikiki, Honolulu, Hawaii, USA. May 21-22, 2011."
210,TH,2,2011,Studying the Evolution of Build Systems,167 226,,2011_StudyingTheEvolutionOfBuildSystems.pdf,49,"Master's Thesis, School of Computing, Faculty of Arts and Science, Queen's University, Ontario, Canada, 2011."
211,TH,2,2011,Automated Discovery of Performance Regressions In Enterprise Applications,128 226,,2011_AutomatedDiscoveryOfPerformanceRegressionsInEnterpriseApplications.pdf,49,"Master's Thesis, Department of Electrical and Computer Engineering, Faculty of Arts and Science, Queen's University, Ontario, Canada, 2011."
31,JO,1,2010,Introduction to the special issue on reverse engineering (WCRE 2008),105 196 197,,JSME_IntroductionToTheSpecialIssueOnReverseEngineering(WCRE2008).pdf,10,Journal of Software Maintenance 22(3): 141-142 (2010)
107,CO,2,2010,Software Intelligence: The Future of Mining Software Engineering Data,105 137,,FSE2010_SoftwareIntelligence_TheFutureOfMiningSoftwareEngineeringData.pdf,18,"In Proceedings of NSF Workshop on the Future of Software Engineering Research, 2010. (Co-located with FSE 2010). Santa Fe, New Mexico, USA. November 7-8, 2010."
108,CO,2,2010,Pinpointing the Subsystems Responsible for the Performance Deviations in a Load Test,162 101 105,http://www.slideshare.net/SAIL_QU/issre2010-malik,ISSRE2010_PinpointingTheSubsystemsResponsibleForThePerformanceDeviationsInALoadTest.pdf,32,"In Proceedings of the 21st Annual International Symposium on Software Reliability Engineering (ISSRE 2010). San Jose, California, USA. November 1-4, 2010."
109,CO,2,2010,Predicting Re-opened Bugs: A Case Study on the Eclipse Project,116 179 147 114 170 101 105 150,http://www.slideshare.net/SAIL_QU/wcre2010-shihab,WCRE2010_PredictingRe-openedBugs_ACaseStudyOnTheEclipseProject.pdf,16,"In Proceedings of the 17th Working Conference on Reverse Engineering (WCRE 2010). Boston, Massachusetts, USA. October 13-16, 2010."
110,CO,2,2010,A Case Study of Bias in Bug-Fix Datasets,168 101 105,,WCRE2010_ACaseStudyOfBiasInBug-FixDatasets.pdf,16,"In Proceedings of the 17th Working Conference on Reverse Engineering (WCRE 2010). Boston, Massachusetts, USA. October 13-16, 2010."
111,CO,2,2010,Studying the Impact of Clones on Software Defects,176 177 113 101 105 115,,WCRE2010_StudyingTheImpactOfClonesOnSoftwareDefects.pdf,16,"In Proceedings of the 17th Working Conference on Reverse Engineering (WCRE 2010). Boston, Massachusetts, USA. October 13-16, 2010."
112,CO,2,2010,Mining Unstructured Data is Like Fishing in Muddy Waters,110 101,http://www.slideshare.net/SAIL_QU/mud2010-bettenburg-presentation,MUD2010_MiningUnstructuredDataIsLikeFishingInMuddyWaters.pdf,53,"In Proceedings of the Workshop on Mining Unstructured Data (MUD), co-located with the 17th Working Conference on Reverse Engineering (WCRE 2010). Boston, Massachusetts, USA. October 13-16, 2010."
113,CO,2,2010,An Experience Report on Scaling Tools for Mining Software Repositories Using MapReduce,113 101 105,http://www.slideshare.net/SAIL_QU/ase2010-shang,ASE2010_AnExperienceReportOnScalingToolsForMiningSoftwareRepositoriesUsingMapReduce.pdf,33,"In Proceedings of the 25th IEEE/ACM International Conference on Automated Software Engineering (ASE 2010). Antwerp, Belgium, September 20-24, 2010."
114,CO,2,2010,Understanding the Impact of Code and Process Metrics on Post-release Defects: A Case Study on the Eclipse Project,116 106 114 101 105,http://www.slideshare.net/SAIL_QU/esem2010-shihab,EMSE2010_UnderstandingTheImpactOfCodeAndProcessMetricsOnPost-releaseDefects_ACaseStudyOnTheEclipseProject.pdf,34,"In Proceedings of the 4th IEEE International Symposium on Empirical Software Engineering and Measurement (ESEM 2010), Bolzano-Bozen, Italy. September 16-17, 2010."
115,CO,2,2010,Revisiting Common Bug Prediction Findings Using Effort-Aware Models,147 148 149 150 101 105,http://www.slideshare.net/SAIL_QU/icsm2010-kamei,ICSM-ICSME2010_RevisitingCommonBugPredictionFindingsUsingEffort-AwareModels.pdf,13,"In Proceedings of the 26th IEEE International Conference on Software Maintenance (ICSM 2010), Timisoara, Romania, September 12-18, 2010."
116,CO,2,2010,Studying the impact of dependency network measures on software quality,168 101 105,,ICSM-ICSME2010_StudyingTheimpactOfdependencynetworkmeasuresOnsoftwarequality.pdf,13,"In Proceedings of the 26th IEEE International Conference on Software Maintenance (ICSM 2010), Timisoara, Romania, September 12-18, 2010."
117,CO,2,2010,Validating the Use of Topic Models for Software Evolution,109 101 105 185,http://www.slideshare.net/SAIL_QU/scam2010-thomas-presentation,SCAM2010_ValidatingTheUseOfTopicModelsForSoftwareEvolution.pdf,29,"In Proceedings of the Tenth IEEE International Working Conference on Source Code Analysis and Manipulation (SCAM 2010). Timisoara, Romania. September 12-13, 2010."
118,CO,2,2010,Using Load Tests To Automatically Compare the Subsystems of a Large Enterprise System,162 101 105 129 146,http://www.slideshare.net/SAIL_QU/compsac2010-malik,COMPSAC2010_UsingLoadTestsToAutomaticallyCompareTheSubsystemsOfALargeEnterpriseSystem.pdf,35,"In Proceedings of the 34th Computer Software and Applications Conference (COMPSAC 2010). Seoul, Korea. July 19-23, 2010."
119,CO,2,2010,Prioritizing Unit Test Creation for Test-Driven Maintenance of Legacy Systems,116 106 101 105 180,http://www.slideshare.net/SAIL_QU/qsic2010-shihab,QSIC2010_PrioritizingUnitTestCreationForTest-DrivenMaintenanceOfLegacySystems.pdf,36,"In Proceedings of the 10th International Conference on Quality Software (QSIC 2010). Zhangjiajie, China. July 14-15, 2010."
120,CO,2,2010,Mining Performance Regression Testing Repositories for Automated Performance Analysis,128 106 101 105 115 129,,QSIC2010_MiningPerformanceRegressionTestingRepositoriesForAutomatedPerformanceAnalysis.pdf,36,"In Proceedings of the 10th International Conference on Quality Software (QSIC 2010). Zhangjiajie, China. July 14-15, 2010."
121,CO,2,2010,Automated Analysis of Load Testing Results,106 226,,ISSTA2010_AutomatedAnalysisOfLoadTestingResults.pdf,37,"In Proceedings of the Doctoral Symposium Track of the 2010 International Conference on Software Testing and Analysis (ISSTA 2010). Trento, Italy. July 12 - July 16, 2010."
122,CO,2,2010,Clustering WSDL Documents to Bootstrap the Discovery of Web Services,127 105 178,,MESOCA2010_ClusteringWSDLDocumentsToBootstrapTheDiscoveryOfWebServices.pdf,28,"In Proceedings of the 8th International Conference on Web Services (ICWS 2010). Miami, USA. July 5 - July 10, 2010."
123,CO,2,2010,Studying the Impact of Social Structures on Software Quality,110 105,http://www.slideshare.net/SAIL_QU/icpc2010-bettenburg,ICPC2010_StudyingTheImpactOfSocialStructuresOnSoftwareQuality.pdf,23,"In Proceedings of the 18th IEEE International Conference on Program Comprehension (ICPC 2010). Braga, Portugal. June 30 - July 2, 2010."
124,CO,2,2010,Visualizing the Results of Field Testing,118 115 105 119,,ICPC2010_VisualizingTheResultsOfFieldTesting.pdf,23,"In Proceedings of the 18th IEEE International Conference on Program Comprehension (ICPC 2010). Braga, Portugal. June 30 - July 2, 2010."
125,CO,2,2010,An Industrial Case Study on Speeding up User Acceptance Testing by Mining Execution Logs,106 145 116 105 129,,SSIRI2010_AnIndustrialCaseStudyOnSpeedingIpUserAcceptanceTestingByMiningExecutionLogs.pdf,39,"In Proceedings of the 4th IEEE International Conference on Secure Software Integration and Reliability Improvement (SSIRI 2010). Singapore. June 9-11, 2010."
126,CO,2,2010,The Evolution of ANT Build Systems,167 101 105,http://www.slideshare.net/SAIL_QU/msr2010-mc-intosh,MSR2010_TheEvolutionOfANTBuildSystems.pdf,15,"In Proceedings of the 7th Working Conference on Mining Software Repositories (MSR 2010). Cape Town, South Africa. May 2-8, 2010."
127,CO,2,2010,Should I contribute to this discussion?,114 110 116 101 105,http://www.slideshare.net/SAIL_QU/msr2010-ibrahim,MSR2010_ShouldIContributeToThisDiscussion_.pdf,15,"In Proceedings of the 7th Working Conference on Mining Software Repositories (MSR 2010). Cape Town, South Africa. May 2-8, 2010."
128,CO,2,2010,Identifying Crosscutting Concerns Using Historical Code Changes,101 106 105,http://www.slideshare.net/SAIL_QU/icse2010-adams-presentation,ICSE2010_IdentifyingCrosscuttingConcernsUsingHistoricalCodeChanges.pdf,14,"In Proceedings of the 32nd International Conference on Software Engineering (ICSE 2010). Cape Town, South Africa. May 2-8, 2010."
129,CO,2,2010,Mining software engineering data,105 137,,ICSE2010_MiningSoftwareEngineeringData.pdf,14,"In Proceedings of the 32nd International Conference on Software Engineering (ICSE 2010). Cape Town, South Africa. May 2-8, 2010."
130,CO,2,2010,A Methodology to Support Load Test Analysis,162 226,http://www.slideshare.net/SAIL_QU/icse2010-malik,ICSE2010_AMethodologyToSupportLoadTestAnalysis.pdf,14,"In Proceedings of the Doctoral Symposium Track of the 32nd International Conference on Software Engineering (ICSE 2010). Cape Town, South Africa. May 2-8, 2010."
131,CO,2,2010,Automatic Comparison of Load Tests to Support the Performance Analysis of Large Enterprise Systems,162 106 101 105 129 146,,ICSM-ICSME2010_AutomaticComparisonOfLoadTestsToSupportThePerformanceAnalysisOfLargeEnterpriseSystems.pdf,13,"In Proceedings of the 14th European Conference on Software Maintenance and Reengineering (CSMR 2010). Madrid, Spain. March 16-18, 2010."
212,TH,2,2010,Enabling Large-Scale Mining Software Repositories (MSR) Studies Using Web-Scale Platforms,113 226,,2010_EnablingLarge-ScaleMiningSoftwareRepositories(MSR)StudiesUsingWeb-ScalePlatforms.pdf,49,"Master's Thesis, School of Computing, Faculty of Arts and Science, Queen's University, Ontario, Canada, 2010."
213,TH,2,2010,Studying Software Evolution Using the Time Dependence of Code Changes,107 226,,2010_StudyingSoftwareEvolutionUsingTheTimeDependenceOfCodeChanges.pdf,49,"Master's Thesis, School of Computing, Faculty of Arts and Science, Queen's University, Ontario, Canada, 2010."
32,JO,1,2009,Guest Editor's Introduction: Special Issue on Mining Software Repositories,123 124 105,,EMSE_GuestEditor'sIntroduction_SpecialIssueOnMiningSoftwareRepositories.pdf,1,"Journal of Empirical Software Engineering, Volume 14, Issue 3, June 2009 Page(s): 257 - 261."
33,JO,1,2009,Change impact graphs: Determining the impact of prior code changes,131 105 132,,IST_ChangeImpactgraphs_DeterminingTheImpactOfPriorCodeChanges.pdf,6,"Information and Software Technology. In Press, May, 2009."
41,IP,1,2009,Automated Verification of Enterprise Load Tests,106 105 146 129,,ISSRE2009_AutomatedVerificationOfEnterpriseLoadTests.pdf,32,"In Proceedings of the Industrial Track at the 20th annual International Symposium on Software Reliability Engineering (ISSRE 2009). Mysuru, India. November, 2009."
42,IP,1,2009,Future of Mining Software Archives: A Roundtable (roundtable contribution),105 226,,IEEESoftware2009_FutureOfMiningSoftwareArchives_ARoundtable(RoundtableContribution).pdf,3,"IEEE Software, 61(1), January/February 2009."
132,CO,2,2009,On the Central Role of Mailing Lists in Open Source Projects: An Exploratory Study,116 110 101 105,http://www.slideshare.net/SAIL_QU/kcsd2009-emad,KCSD2009_OnTheCentralRoleOfMailingListsInOpenSourceProjects_AnExploratoryStudy.pdf,40,"In Proceedings of of the 3rd International Workshop on Knowledge Collaboration in Software Development (KCSD) 2009, Tokyo, Japan, Nov. 19-20, 2009."
133,CO,2,2009,A Case Study on the Impact of Global Participation on Mailing Lists Communications of Open Source Projects,183 105 115,,KCSD2009_ACaseStudyOnTheImpactOfGlobalParticipationOnMailingListsCommunicationsOfOpenSourceProjects.pdf,40,"In Proceedings of of the 3rd International Workshop on Knowledge Collaboration in Software Development (KCSD) 2009, Tokyo, Japan, Nov. 19-20, 2009."
134,CO,2,2009,A Study of the Time Dependence of Code Changes,107 101 105,http://www.slideshare.net/SAIL_QU/wcre2009-alam,WCRE2009_AStudyOfTheTimeDependenceOfCodeChanges.pdf,16,"In Proceedings of the 25th IEEE Working Conference on Reverse Engineering (WCRE), Lille, France, October 15-18, 2009."
135,CO,2,2009,An Empirical Study on Inconsistent Changes to Code Clones at Release Level,110 113 114 101 115 105,,WCRE2009_AnEmpiricalStudyOnInconsistentChangesToCodeClonesAtReleaseLevel.pdf,16,"In Proceedings of the 25th IEEE Working Conference on Reverse Engineering (WCRE), Lille, France, October 15-18, 2009."
136,CO,2,2009,Techniques for Identifying the Country Origin of Mailing List Participants,183 105 115,,WCRE2009_TechniquesForIdentifyingTheCountryOriginOfMailingListParticipants.pdf,16,"In Proceedings of the 25th IEEE Working Conference on Reverse Engineering (WCRE), Lille, France, October 15-18, 2009."
137,CO,2,2009,An Empirical Study on the Risks of Using Off-the-Shelf Techniques for Processing Mailing List Data,110 116 105,http://www.slideshare.net/SAIL_QU/icsm2009-bettenburg-presentation,ICSM-ICSME2009_AnEmpiricalStudyOnTheRisksOfUsingOff-the-ShelfTechniquesforProcessingMailingListData.pdf,13,"In Proceedings of the 25th IEEE International Conference on Software Maintenance (ICSM) 2009, Edmonton, Canada, September 20-26, 2009."
138,CO,2,2009,Visualizing the Structure of Field Testing Problems,118 115 105 119,,ICSM-ICSME2009_VisualizingTheStructureOfFieldTestingProblems.pdf,13,"In Proceedings of the 25th IEEE International Conference on Software Maintenance (ICSM) 2009, Edmonton, Canada, September 20-26, 2009."
139,CO,2,2009,Automated Performance Analysis of Load Tests,106 105 146 129,http://www.slideshare.net/SAIL_QU/icsm2009-jiang,ICSM-ICSME2009_AutomatedPerformanceAnalysisOfLoadTests.pdf,13,"In Proceedings of the 25th IEEE International Conference on Software Maintenance (ICSM) 2009, Edmonton, Canada, September 20-26, 2009."
140,CO,2,2009,Studying the Use of Developer IRC Meetings in Open Source Projects,116 106 105,http://www.slideshare.net/SAIL_QU/icsm2009-shihab,ICSM-ICSME2009_StudyingTheUseOfDeveloperIRCMeetingsInOpenSourceProjects.pdf,13,"In Proceedings of the 25th IEEE International Conference on Software Maintenance (ICSM) 2009, Edmonton, Canada, September 20-26, 2009."
141,CO,2,2009,Measuring the Progress of Projects Using the Time Dependence of Code Changes,107 101 105,http://www.slideshare.net/SAIL_QU/icsm2009-alam,ICSM-ICSME2009_MeasuringTheProgressOfProjectsUsingTheTimeDependenceOfCodeChanges.pdf,13,"In Proceedings of the 25th IEEE International Conference on Software Maintenance (ICSM) 2009, Edmonton, Canada, September 20-26, 2009."
142,CO,2,2009,Co-Evolution of Source Code and the Build System,101 226,http://www.slideshare.net/SAIL_QU/icsm2009-adams-phd,ICSM-ICSME2009_Co-EvolutionOfSourceCodeAndTheBuildSystem.pdf,13,"In PhD Symposium at the 25th IEEE International conference on Software Maintenance (ICSM) 2009, Edmonton, Canada, September 22, 2009."
143,CO,2,2009,MapReduce as a General Framework to Support Research in Mining Software Repositories (MSR),113 106 101 105,http://www.slideshare.net/SAIL_QU/msr2009-ian,MSR2009_MapReduceAsAGeneralFrameworkToSupportResearchInMiningSoftwareRepositories(MSR).pdf,15,"In Proceedings of the 6th IEEE Working conference on Mining Software Repositories (MSR) 2009, Vancouver, Canada, May 16 - May 17, 2009."
144,CO,2,2009,On the use of Internet Relay Chat (IRC) meetings by developers of the GNOME GTK+ project,116 106 105,http://www.slideshare.net/SAIL_QU/msr2009-emad,"MSR2009_OnTheUseOfInternetRelayChat(IRC),eetingsBydevelopersOfTheGNOMEGTK+Project.pdf",15,"In Proceedings of the 6th IEEE Working conference on Mining Software Repositories (MSR) 2009, Vancouver, Canada, May 16 - May 17, 2009."
145,CO,2,2009,Predicting Faults Using the Complexity of Code Changes,105 226,,ICSE2009_PredictingFaultsUsingTheComplexityOfCodeChanges.pdf,14,"In Proceedings of the 31st International Conference on Software Engineering (ICSE) 2009, Vancouver, Canada, May 16-24, 2009."
146,CO,2,2009,License Integration Patterns: Addressing License Mismatches in Component-Based Development?,131 105,,ICSE2009_LicenseIntegrationPatterns_AddressingLicenseMismatchesInComponent-BasedDevelopment_.pdf,14,"In Proceedings of the 31st International Conference on Software Engineering (ICSE) 2009, Vancouver, Canada, May 16-24, 2009."
147,CO,2,2009,Can we Refactor Conditional Compilation into Aspects?,101 103 104 105,http://www.slideshare.net/SAIL_QU/aosd2009-adams,AOSD2009_CanWeRefactorConditionalCompilationIntoAspects_.pdf,41,"In Proceedings of the 8th International Conference on Aspect-Oriented Software Development (AOSD) 2009, Charlottesville, Virginia, USA, March 2 - 6, 2009."
214,TH,2,2009,Automated Capacity Planning and Support for Enterprise Applications,184 226,,2009_AutomatedCapacityPlanningAndSupportForEnterpriseApplications.pdf,49,"Master's Thesis, School of Computing, Faculty of Arts and Science, Queen's University, Ontario, Canada, 2009."
34,JO,1,2008,An Automated Approach for Abstracting Execution Logs to Execution Events,106 105 129 146,,JSME_AnAutomatedApproachForAbstractingExecutionLogsToExecutionEvents.pdf,10,"In the Special Issue on Program Comprehension through Dynamic Analysis of Wiley's Journal of Software Maintenance and Evolution: Research and Practice. Volume 20, Issue 4, 2008, pp. 249-267."
43,IP,1,2008,The Road Ahead for Mining Software Repositories,105 226,,ICSM-ICSME2008_TheRoadAheadForMiningSoftwareRepositories.pdf,13,"In Proceedings of the Future of Software Maintenance (FoSM) at the 24th IEEE International Conference on Software Maintenance (ICSM) 2008, Beijing, China, September 28 - October 2, 2008."
148,CO,2,2008,Automatic Identification of Load Testing Problems,106 105 129 146,http://www.slideshare.net/SAIL_QU/icsm2008-jiang,ICSM-ICSME2008_AutomaticIdentificationOfLoadTestingProblems.pdf,13,"In Proceedings of the 24th IEEE International Conference on Software Maintenance (ICSM) 2008, Beijing, China, September 28 - October 2, 2008."
149,CO,2,2008,Retrieving Relevant Reports from a Customer Engagement Repository,184 106 105 146 129,,ICSM-ICSME2008_RetrievingRelevantReportsFromACustomerEngagementRepository.pdf,13,"In Proceedings of the 24th IEEE International Conference on Software Maintenance (ICSM) 2008, Beijing, China, September 30 - October 2, 2008. Slides"
150,CO,2,2008,Supporting Software Evolution Using Adaptive Change Propagation,162 105,,ICSM-ICSME2008_SupportingSoftwareEvolutionUsingAdaptiveChangePropagation.pdf,13,"In Proceedings of the 24th IEEE International Conference on Software Maintenance (ICSM) 2008, Beijing, China, September 30 - October 2, 2008."
151,CO,2,2008,Understanding the Rationale for Updating a Function's Comment,162 163 164 106 105,,ICSM-ICSME2008_UnderstandingTheRationaleForUpdatingAFunction'sComment.pdf,13,"In Proceedings of the 24th IEEE International Conference on Software Maintenance (ICSM) 2008, Beijing, China, September 30 - October 2, 2008."
152,CO,2,2008,Determining the Impact of Prior Code Changes,131 132 105,,SCAM2008_DeterminingTheImpactOfPriorCodeChanges.pdf,29,"In Proceedings of the Eighth IEEE International Working Conference on Source Code Analysis and Manipulation (SCAM), Beijing, China, September 28 - 29, 2008."
153,CO,2,2008,Abstracting Execution Logs to Execution Events for Enterprise Applications,106 105 129 146,http://www.slideshare.net/SAIL_QU/qsic2008-jiang,QSIC2008_AbstractingExecutionLogsToExecutionEventsForEnterpriseApplications.pdf,36,"In Proceedings of the 8th International Conference on Quality Software (QSIC), Oxford, UK, August 12-13, 2008."
154,CO,2,2008,A Framework for Measurement Based Performance Modeling,184 105 146 129,,WOSP2008_AFrameworkForMeasurementBasedPerformanceModeling.pdf,42,"In Proceedings of the Seventh International Workshop on Software and Performance (WOSP) 2008, Princeton, NJ, USA, June 23-26, 2008. Slides"
155,CO,2,2008,An Industrial Case Study of Customizing Operational Profiles Using Log Compression,105 133 129 134 135,,ICSE2008_AnIndustrialCaseStudyOfCustomizingOperationalProfilesUsingLogCompression.pdf,14,"Proceedings of the 30th IEEE/ACM International Conference on Software Engineering (ICSE), Leipzig, Germany, May 14-16, 2008"
156,CO,2,2008,Automated Classification of Change Messages in Open Source Projects,105 226,,SAC2008_AutomatedClassificationOfChangeMessagesInOpenSourceProjects.pdf,43,"Proceedings of ACM Symposium on Applied Computing (SAC), Fortaleza, Ceara, Brazil, March 16-20, 2008. pp 837-841"
222,ED,2,2008,"Proceedings of the 2008 International Working Conference on Mining Software Repositories, MSR 2008 (Co-located with ICSE), Leipzig, Germany, May 10-11, 2008, Proceedings",105 225 139,,,14,"ACM 2008, ISBN 978-1-60558-024-1"
223,ED,2,2008,"WCRE 2008, Proceedings of the 15th Working Conference on Reverse Engineering, Antwerp, Belgium, October 15-18, 2008",105 196 197,,,16,"IEEE Computer Society 2008, ISBN 978-0-7695-3429-9"
157,CO,2,2007,Empirical Evidence for SOC Dynamics in Software Evolution,136 126 105,,ICSM-ICSME2007_EmpiricalEvidenceForSOCDynamicsInSoftwareEvolution.pdf,13,"Proceedings of ICSM 2007_ International Conference on Software Maintenance, Maison Internationale, Paris, France, Oct 2-5, 2007."
158,CO,2,2007,A Framework for Studying Clones In Large Software Systems,106 105,,SCAM2007_AFrameworkForStudyingClonesInLargeSoftwareSystems.pdf,29,"Proceedings of SCAM 2007: International Working Conference on Source Code Analysis and Manipulation, Maison Internationale, Paris, France, Sept 30 - Oct 1, 2007."
159,CO,2,2007,Detecting Interaction Coupling from Task Interaction Histories,188 139 105,,ICPC2007_DetectingInteractionCouplingFromTaskInteractionHistories.pdf,23,"Proceedings of ICPC 2007: International Conference Program Comprehension, Banff, Alberta, June 26-29, 2007. Slides."
160,CO,2,2007,What Can OSS Mailing Lists Tell Us? A Preliminary Psychometric Text Analysis of the Apache Developer Mailing List,174 105,,MSR2007_WhatCanOSSMailingListsTellUs_APreliminaryPsychometricTextAnalysisOfTheApacheDeveloperMailingList.pdf,15,"Proceedings of MSR 2007: International Workshop on Mining Software Repositories, Minneapolis, USA, May 19-20, 2007."
161,CO,2,2007,Mining software engineering data,137 217 105,,ICSE2007_MiningSoftwareEngineeringData.pdf,14,"In Proceedings of the 29th International Conference on Software Engineering (ICSE 2007). Minneapolis, MN, US. May 19-27."
162,CO,2,2007,MythSE-myths in software engineering half day ICSM 2007 working session,105 154,,ICSM-ICSME2007_MythSE-MythsInSoftwareEngineeringHalfDayICSM2007WorkingSession.pdf,13,"International Conference on Software Maintenance, Maison Internationale, Paris, France, Oct 2-5, 2007."
194,PA,2,2007,MythSE -- Myths in Software Engineering,105 154,,ICSM-ICSME2007_MythSE--MythsInSoftwareEngineering.pdf,13,"Proceedings of ICSM 2007:International Conference on Software Maintenance, Maison Internationale, Paris, France, Oct 5, 2007."
195,PA,2,2007,Performance Engineering in Industry: Current Practices and Adoption Challenges,105 129,,WOSP2007_PerformanceEngineeringInIndustry_CurrentPracticesAndAdoptionChallenges.pdf,42,"Proceedings of WOSP 2007: Sixth International Workshop on Software and Performance, Buenos Aires, Argentina, Feb 5, 2007. Panelists: Alberto Avritzer (Siemens USA Research Lab), Parminder Flora (Research In Motion), Richard Friedrich (HP Labs), Marin Litoiu (IBM Toronto Lab), Kevin Mobley (Fidelity Information)."
