id,Type,Topic,Year,Title,Authors,URL,pdf,Venue,Details
35,JO,1,2006,Replaying Development History to Assess the Effectiveness of Change Propagation Tools,105 126,,EMSE_ReplayingDevelopmentHistoryToAssessTheEffectivenessOfChangePropagationTools.pdf,1,"Best Papers of ICSM 2005 (20th Anniversary), Journal of Empirical Software Engineering, 2006."
163,CO,2,2006,Visualizing Clone Cohesion and Coupling,106 105 126,,APSEC2006_VisualizingCloneCohesionAndCoupling.pdf,26,"Proceedings of APSEC 2006: IEEE Asia Pacific Conference on Software Engineering, Bangalore, India, Dec. 6-8, 2006."
164,CO,2,2006,Animated Visualization of Software History Using Evolution Storyboards,117 105,,WCRE2006_AnimatedVisualizationOfSoftwareHistoryUsingEvolutionStoryboards.pdf,16,"Proceedings of WCRE 2006: International Conference on Reverse Engineering, Benevento, Italy, pp. 199-208, Oct. 23-27, 2006."
165,CO,2,2006,Mining software repositories to assist developers and support managers,105 226,,ICSM-ICSME2006_MiningSoftwareRepositoriesToAssistDevelopersAndSupportManagers.pdf,13,"Proceedings of ICSM 2006: IEEE International Conference on Software Maintenance, Chicago, Philadelphia, USA, pp. 339-342, Sept. 24-27, 2006."
166,CO,2,2006,Using Decision Trees to Predict the Certification Result of a Build,105 138,,ASE2006_UsingDecisionTreesToPredictTheCertificationResultOfABuild.pdf,33,"Proceedings of ASE 2006: 21st IEEE/ACM International Conference on Automated Software Engineering, Tokyo, Japan, September 18-22, 2006."
167,CO,2,2006,Studying the Evolution of Software Systems Using Change Clusters,158 159 160 161 105,,ICPC2006_StudyingTheEvolutionOfSoftwareSystemsUsingChangeClusters.pdf,23,"Proceedings of ICPC 2006: International Conference on Program Comprehension, Athens, Greece, June 14-16, 2006."
168,CO,2,2006,Evolution Storyboards: Visualization of Software Structure Dynamics,117 105,,ICPC2006_EvolutionStoryboards_VisualizationOfSoftwareStructureDynamics.pdf,23,"Proceedings of ICPC 2006: International Conference on Program Comprehension, Athens, Greece, June 14-16, 2006."
169,CO,2,2006,TA-RE: an exchange language for mining software repositories,153 154 130 105 140 155 125 156 157,,MSR2006_TA-RE_AnExchangeLanguageForMiningSoftwareRepositories.pdf,15,"Proceedings of MSR 2006: International Workshop on Mining Software Repositories, Shanghai, China, May 22-23, 2006."
170,CO,2,2006,Examining the Evolution of Code Comments in PostgreSQL,106 105,,MSR2006_ExaminingTheEvolutionOfCodeCommentsInPostgreSQL.pdf,15,"Proceedings of MSR 2006: International Workshop on Mining Software Repositories, Shanghai, China, May 22-23, 2006."
171,CO,2,2006,MSR 2006: The International Workshop on Mining Software Repositories,123 124 125 105,,ICSE2006_MSR2006_TheInternationalWorkshopOnMiningSoftwareRepositories.pdf,14,"Proceedings of ICSE 2006: International Conference on Software Engineering, Shanghai, China, May 20-28, 2006."
215,TH,2,2006,Visualizing and Understanding Code Duplication in Large Software Systems,106 226,,2006_VisualizingAndUnderstandingCodeDuplicationInLargeSoftwareSystems.pdf,49,"Master's Thesis, The David R. Cheriton School of Computer Science, Faculty of Mathematics, University of Waterloo, Ontario, Canada, 2006."
224,WO,2,2006,MSR 2006: the 3rd international workshop on mining software repositories,123 124 125 105,,,14,ICSE 2006: 1021
225,WO,2,2006,Introduction to MSR 2006,123 124 125 105,,,14,MSR 2006: 1-2
226,ED,2,2006,"Proceedings of the 2006 International Workshop on Mining Software Repositories, MSR 2006, Shanghai, China, May 22-23, 2006",123 124 105,,,14,"ACM 2006, ISBN 1-59593-397-2"
36,JO,1,2005,Workshop Report for MSR 2005: International Workshop on Mining Software Repositories,123 105 126,,SoftwareEngineeringNotes_WorkshopReportforMSR2005_InternationalWorkshopOnMiningSoftwareRepositories.pdf,11,"ACM SIGSOFT Software Engineering Notes, Sept 2005."
37,JO,1,2005,Guest Editor's Introduction: Special Issue on Mining Software Repositories,105 140 126 198,,TSE_GuestEditor'sIntroduction_SpecialIssueOnMiningSoftwareRepositories.pdf,4,"Software Engineering, IEEE Transactions on Volume 31, Issue 6, June 2005 Page(s):426 - 428."
38,JO,1,2005,A Lightweight Approach for Migrating Web Frameworks,105 126,,IST_ALightweightApproachForMigratingWebFrameworks.pdf,6,"Journal of Information and Software Technology, Volume: 47, Issue: 8, June 1, 2005, pp. 521-532."
39,JO,1,2005,Workshop Report for MSR 2004: International Workshop on Mining Software Repositories,105 126 140,,SoftwareEngineeringNotes_WorkshopReportForMSR2004_InternationalWorkshopOnMiningSoftwareRepositories.pdf,11,"ACM SIGSOFT Software Engineering Notes, Jan 2005."
172,CO,2,2005,Source versus Object Code Extraction For Recovering Software Architecture,105 106 126,,WCRE2005_SourceVersusObjectCodeExtractionForRecoveringSoftwareArchitecture.pdf,16,"Proceedings of WCRE 2005: Working Conference on Reverse Engineering, Pittsburgh (Carnegie Mellon), USA, November 8-11, 2005."
173,CO,2,2005,The Top Ten List: Dynamic Fault Prediction,105 126,,ICSM-ICSME2005_TheTopTenList_DynamicFaultPrediction.pdf,13,"Proceedings of ICSM 2005: International Conference on Software Maintenance, Budapest, Hungary, Sept 25-30, 2005."
174,CO,2,2005,Comparison of Clustering Algorithms in the Context of Software Evolution,136 105 126,,ICSM-ICSME2005_ComparisonOfClusteringAlgorithmsInTheContextOfSoftwareEvolution.pdf,13,"Proceedings of ICSM 2005: International Conference on Software Maintenance, Budapest, Hungary, Sept 25-30, 2005."
175,CO,2,2005,Visualizing Historical Data Using Spectrographs,105 136 126,,METRICS2005_VisualizingHistoricalDataUsingSpectrographs.pdf,45,"Proceedings of METRICS 2005: 11th IEEE International Software Metrics Symposium, Como, Italy, Sept 19-22, 2005."
176,CO,2,2005,MSR 2005: The International Workshop on Mining Software Repositories,105 126 123,,ICSE2005_MSR2005_TheInternationalWorkshopOnMiningSoftwareRepositories.pdf,14,"Proceedings of ICSE 2005: International Conference on Software Engineering, Saint Louis, Missouri, USA, May 15-21, 2005."
184,CO,2,2005,MSR 2005: The International Workshop on Mining Software Repositories,105 126 140,,ICSE2005_MSR2005_TheInternationalWorkshopOnMiningSoftwareRepositories.pdf,14,"Proceedings of ICSE 2004: International Conference on Software Engineering, Scotland, UK, May 23-28, 2004."
228,JO,2,2005,Report on MSR 2005: international workshop on mining software repositories,123 105 126,,,14,ACM SIGSOFT Software Engineering Notes 30(5): 1-3 (2005)
229,WO,2,2005,MSR 2005 international workshop on mining software repositories,105 126 123,,,14,ICSE 2005: 690
177,CO,2,2004,The Small World of Software Reverse Engineering,105 126,,WCRE2004_TheSmallWorldOfSoftwareReverseEngineering.pdf,16,"Proceedings of WCRE 2004: Working Conference on Reverse Engineering, Delft University of Technology, the Netherlands, Nov 9-12, 2004."
178,CO,2,2004,Exploring Software Evolution Using Spectrographs,136 105 126,,WCRE2004_ExploringSoftwareEvolutionUsingSpectrographs.pdf,16,"Proceedings of WCRE 2004: Working Conference on Reverse Engineering, Delft University of Technology, the Netherlands, Nov 9-12, 2004."
179,CO,2,2004,Predicting Change Propagation in Software Systems,105 126,,ICSM-ICSME2004_PredictingChangePropagationInSoftwareSystems.pdf,13,"Proceedings of ICSM 2004: International Conference on Software Maintenance, Chicago, Illinois, USA, Sept 11-17, 2004."
180,CO,2,2004,Studying The Evolution of Software Systems Using Evolutionary Code Extractors,105 126,,IWPSE2004_StudyingTheEvolutionOfSoftwareSystemsUsingEvolutionaryCodeExtractors.pdf,46,"Proceedings of IWPSE 2004: International Workshop on Principles of Software Evolution, Kyoto, Japan, Sept 6-7, 2004."
181,CO,2,2004,Evolution Spectrographs: Visualizing Punctuated Change in Software Evolution,136 186 105 126,,IWPSE2004_EvolutionSpectrographs_VisualizingPunctuatedChangeInSoftwareEvolution.pdf,46,"Proceedings of IWPSE 2004: International Workshop on Principles of Software Evolution, Kyoto, Japan, Sept 6-7, 2004."
183,CO,2,2004,Using Development History Sticky Notes to Understand Software Architecture,105 126,,IWPC2004_UsingDevelopmentHistoryStickyNotesToUnderstandSoftwareArchitecture.pdf,23,"Proceedings of IWPC 2004: International Workshop on Program Comprehension, Bari, Italy, Jun 24-26, 2004."
216,TH,2,2004,Mining Software Repositories to Assist Developers and Support Managers,105 226,,2004_MiningSoftwareRepositoriesToAssistDevelopersAndSupportManagers.pdf,48,"PhD Thesis, School of Computer Science, Faculty of Mathematics, University of Waterloo, Ontario, Canada, 2004."
227,JO,2,2004,Report on MSR 2004: International workshop on mining software repositories,105 126 140,,,14,ACM SIGSOFT Software Engineering Notes 30(1): 4 (2005)
230,WO,2,2004,MSR 2004: International Workshop on Mining Software Repositories,105 126 140,,,14,ICSE 2004: 770-771
40,JO,1,2003,A Visual Architectural Approach to Maintaining Web Applications,105 126,,AnnalsOfSoftwareEngineering_AVisualArchitecturalApproachToMaintainingWebApplications.pdf,12,"Annals of Software Engineering - Volume 16 - Special Volume on Software Visualization, 2003."
185,CO,2,2003,Studying The Chaos of Code Development,105 126,,WCRE2003_StudyingTheChaosOfCodeDevelopment.pdf,16,"Proceedings of WCRE 2003: Working Conference on Reverse Engineering, Victoria, British Columbia, Canada, Nov 13-16, 2003."
186,CO,2,2003,Migrating Web Frameworks Using Water Transformations,105 126,,COMPSAC2003_MigratingWebFrameworksUsingWaterTransformations.pdf,35,"Proceedings of COMPSAC 2003: International Computer Software and Application Conference, Dallas, Texas, USA, Nov 3-6, 2003."
187,CO,2,2003,The Chaos of Software Development,105 126,,IWPSE2003_TheChaosOfSoftwareDevelopment.pdf,46,"Proceedings of IWPSE 2003: International Workshop on Principles of Software Evolution, Helsinki, Finland, Sept 1-2, 2003."
196,PP,2,2003,ADG: Annotated Dependency Graphs for Software Understanding,105 126,,VISSOFT2003_ADG_AnnotatedDependencyGraphsForSoftwareUnderstanding.pdf,55,"Proceedings of VISSOFT 2003: 2nd Annual DESIGNFEST On Visualizing Software For Understanding And Analysis (co-located with ICSM'2003), Amsterdam, the Netherlands, Sept 22, 2003."
197,PP,2,2003,Migrating Web Applications,105 126,,AWSA2003_MigratingWebApplications.pdf,56,"Proceedings of ASERC Workshop on Software Architecture, Banff, Alberta, Canada, Feb 18-19, 2003."
188,CO,2,2002,Using Graph Patterns to Extract Scenarios,136 105 126,,IWPC2002_UsingGraphPatternsToExtractScenarios.pdf,23,"Proceedings of IWPC 2002: International Workshop on Program Comprehension, La Sorbonne, Paris, France, Jun 26-29, 2002."
189,CO,2,2002,Architecture Recovery of Web Applications,105 126,,ICSE2002_ArchitectureRecoveryOfWebApplications.pdf,14,"Proceedings of ICSE 2002: International Conference on Software Engineering, Orlando, Florida, May 19-25, 2002."
190,CO,2,2001,Towards a Better Understanding of Web Application,105 126,,WSE2001_TowardsABetterUnderstandingOfWebApplication.pdf,27,"Proceedings of WSE 2001: International Workshop on Web Site Evolution, Florence, Italy, Nov 10, 2001."
198,PP,2,2001,Software Engineering Research in the Bazaar,105 139 126,,ICSE2001_SoftwareEngineeringResearchInTheBazaar.pdf,14,"Proceedings of ICSE 2001: 1st Workshop on Open Source Software Engineering, Toronto, Canada. May, 2001."
217,TH,2,2001,Architecture Recovery of Web Applications,105 226,,2001_ArchitectureRecoveryOfWebApplications.pdf,49,"Master's Thesis, Department of Computer Science, Faculty of Mathematics, University of Waterloo, Ontario, Canada, 2001."
191,CO,2,2000,E/R Schema for the Datrix C/C++/Java Exchange Format,126 105 142 143 144,,"WCRE2000_E-RSchemaForTheDatrixC,C++,JavaExchangeFormat.pdf",16,"Proceedings of Data Exchange Format session - WCRE 2000: Working Conference on Reverse Engineering, Brisbane, Australia, Nov 23-25, 2000."
192,CO,2,2000,A Reference Architecture for Web Servers,105 126,,WCRE2000_AReferenceArchitectureForWebServers.pdf,16,"Proceedings of WCRE 2000: Working Conference on Reverse Engineering, Brisbane, Australia, Nov 23-25, 2000."
199,TD,2,2000,Architecture Recovery of Web Applications,105 126 139 218,,,22,"In CASCON 2000, Missisauage, Ontario, Canada, Nov 13-16, 2000."
200,TD,2,2000,Big Picture of Big Software: Visualizing Software Architectures of Object Oriented Systems,172 173 126 105,,,47,"In ECOOP 2000: 14th European Conference on Object-Oriented Programming, Sophia Antipolis and Cannes, France, Jun 12-16, 2000."